{
  "$schema": "https://json-schema.org/draft/2020-12/schema",
  "title": "Kingdom Death catalog",
  "type": "object",
  "required": ["content", "dice", "bundles", "homebrew"],
  "additionalProperties": false,
  "properties": {
    "$schema": { "type": "string" },
    "content": { "$ref": "#/$defs/content" },
    "dice": { "$ref": "#/$defs/dice" },
    "bundles": { "$ref": "#/$defs/bundles" },
    "homebrew": { "$ref": "#/$defs/content" }
  },
  "$defs": {
    "edition": {
      "type": "object",
      "required": ["v", "$"],
      "additionalProperties": false,
      "properties": {
        "v": { "type": "string" },
        "$": { "type": "array", "items": { "type": "number" } },
        "limit": { "type": "boolean" },
        "r": { "type": "string" }
      }
    },
    "contentItem": {
      "type": "object",
      "required": ["name", "kind", "gameplay", "tags"],
      "additionalProperties": false,
      "properties": {
        "name": { "type": "string" },
        "alt": { "type": "string", "description": "Alternative or corrected name." },
        "desc": { "type": "string", "description": "Item description." },
        "kind": {
          "enum": ["core", "beta", "promo", "expansion", "white-box", "set", "model", "base", "terrain", "accessory"]
        },
        "gameplay": { "type": "boolean" },
        "price": { "type": "number" },
        "currency": { "enum": ["USD", "EUR"], "default": "USD" },
        "priceMinimum": { "type": "boolean", "default": false },
        "versions": { "type": "array", "items": { "$ref": "#/$defs/edition" } },
        "editions": { "type": "array", "items": { "$ref": "#/$defs/edition" } },
        "tags": { "type": "array", "items": { "type": "string" } },
        "requires": { "type": "array", "items": { "type": "string" } },
        "url": { "type": "string" },
        "shopReachable": { "$ref": "#/$defs/shopReachable" }
      }
    },
    "content": {
      "type": "object",
      "additionalProperties": { "$ref": "#/$defs/contentItem" }
    },
    "diceItem": {
      "type": "object",
      "required": ["name", "colors", "text", "tags"],
      "additionalProperties": false,
      "properties": {
        "name": { "type": "string" },
        "price": { "type": "number" },
        "currency": { "enum": ["USD", "EUR"], "default": "USD" },
        "colors": {
          "type": "array",
          "minItems": 2,
          "maxItems": 2,
          "items": { "type": "string" }
        },
        "text": {
          "type": "array",
          "minItems": 2,
          "maxItems": 2,
          "items": { "type": "string" }
        },
        "tags": { "type": "array", "items": { "type": "string" } },
        "url": { "type": "string" },
        "shopReachable": { "$ref": "#/$defs/shopReachable" }
      }
    },
    "dice": {
      "type": "object",
      "additionalProperties": { "$ref": "#/$defs/diceItem" }
    },
    "bundleItem": {
      "type": "object",
      "required": ["name", "gameplay", "tags", "includes"],
      "additionalProperties": false,
      "properties": {
        "name": { "type": "string" },
        "price": { "type": "number" },
        "currency": { "enum": ["USD", "EUR"], "default": "USD" },
        "gameplay": { "type": "boolean" },
        "tags": { "type": "array", "items": { "type": "string" } },
        "includes": { "type": "array", "items": { "type": "string" } },
        "url": { "type": "string" },
        "shopReachable": { "$ref": "#/$defs/shopReachable" }
      }
    },
    "shopReachable": {
      "type": ["boolean", "null"],
      "description": "Latest HEAD check: true for HTTP 2xx after redirects, false for HTTP or request errors, null when no URL exists. Omitted until checked."
    },
    "bundles": {
      "type": "object",
      "additionalProperties": { "$ref": "#/$defs/bundleItem" }
    }
  }
}
