{
  "$schema": "./schema.json",
  "content": {
    "core": {
      "name": "Kingdom Death: Monster",
      "kind": "core",
      "gameplay": true,
      "price": 44400,
      "versions": [
        { "v": "Sim", "$": [2000], "r": "2022-11-25" },
        { "v": "1.3", "$": [10000], "r": "2015-09-15" },
        { "v": "1.5", "$": [25000], "r": "2017-10-13" },
        { "v": "1.6", "$": [40000, 44400], "r": "2021-11-26" }
      ],
      "url": "/products/kingdom-death-monster-1-6",
      "tags": [
        "core",
        "monster-phoenix",
        "monster-white-lion",
        "monster-butcher",
        "monster-gold-smoke-knight",
        "monster-kings-man",
        "monster-hand",
        "monster-screaming-antelope",
        "monster-watcher",
        "survivor",
        "male",
        "female",
        "allister",
        "lucy",
        "erza",
        "zachary",
        "novel-proficiency",
        "weapon-proficiency"
      ],
      "shopReachable": true
    },
    "expansion-gamblers-chest": {
      "name": "Gambler's Chest Expansion",
      "kind": "expansion",
      "gameplay": true,
      "price": 42000,
      "versions": [
        { "v": "Sim", "$": [4200], "r": "2025-11-25" },
        { "v": "1.6", "$": [37000, 42000], "r": "2021-11-26" }
      ],
      "url": "/products/gamblers-chest-expansion",
      "tags": [
        "expansion",
        "core",
        "campaign",
        "gamblers-chest",
        "arc-survivor",
        "smog-singers",
        "crimson-crocodile",
        "king",
        "atnas",
        "survivor",
        "male",
        "female"
      ],
      "shopReachable": true
    },
    "expansion-flower-knight": {
      "name": "Flower Knight Expansion",
      "kind": "expansion",
      "gameplay": true,
      "price": 8000,
      "versions": [
        { "v": "Sim", "$": [700], "r": "2025-11-25" },
        { "v": "1.6", "$": [6500, 8000], "r": "2021-11-26" }
      ],
      "url": "/products/flower-knight-expansion-1-6",
      "tags": ["expansion", "monster-flower-knight", "knight", "node-2-quarry"],
      "shopReachable": true
    },
    "expansion-dung-beetle-knight": {
      "name": "Dung Beetle Knight Expansion",
      "kind": "expansion",
      "gameplay": true,
      "price": 8000,
      "versions": [
        { "v": "Sim", "$": [700], "r": "2025-11-25" },
        { "v": "1.5", "$": [8000], "r": "2021-11-26" },
        { "v": "1.6", "$": [6500, 8000], "r": "2021-11-26" },
        { "v": "1.7", "$": [8000], "r": "Q4 2026" }
      ],
      "url": "/products/dung-beetle-expansion-1-6",
      "tags": ["expansion", "monster-dung-beetle-knight", "knight", "node-4-quarry"],
      "shopReachable": true
    },
    "expansion-frogdog": {
      "name": "Frogdog Expansion",
      "kind": "expansion",
      "gameplay": true,
      "versions": [
        { "v": "Sim", "$": [1200], "r": "2025-01-01" },
        { "v": "1.6", "$": [13500], "r": "2024-01-01" }
      ],
      "url": "/products/frogdog-expansion",
      "tags": ["expansion", "monster-frogdog", "monster-bullfrogdog", "node-1-quarry", "gear", "armor"],
      "shopReachable": true
    },
    "expansion-gorm": {
      "name": "Gorm Expansion",
      "kind": "expansion",
      "gameplay": true,
      "price": 8000,
      "versions": [
        { "v": "Sim", "$": [700], "r": "2025-11-25" },
        { "v": "1.6", "$": [6500, 8000], "r": "2021-11-26" }
      ],
      "url": "/products/gorm-expansion-1-6",
      "tags": ["expansion", "monster-gorm", "node-1-quarry", "gear", "armor"],
      "shopReachable": true
    },
    "expansion-spidicules": {
      "name": "Spidicules Expansion",
      "kind": "expansion",
      "gameplay": true,
      "price": 8000,
      "versions": [
        { "v": "Sim", "$": [700], "r": "2025-11-25" },
        { "v": "1.6", "$": [6500, 8000], "r": "2021-11-26" }
      ],
      "url": "/products/spidicules-expansion-1-6",
      "tags": ["expansion", "monster-spidicules", "node-2-quarry", "silk", "gear"],
      "shopReachable": true
    },
    "expansion-sunstalker": {
      "name": "Sunstalker Expansion",
      "kind": "expansion",
      "gameplay": true,
      "price": 8000,
      "versions": [
        { "v": "Sim", "$": [700], "r": "2025-11-25" },
        { "v": "1.6", "$": [6500, 8000], "r": "2021-11-26" }
      ],
      "url": "/products/sunstalker-expansion",
      "tags": ["expansion", "monster-sunstalker", "campaign", "node-3-quarry", "pot-sun"],
      "shopReachable": true
    },
    "expansion-dragon-king": {
      "name": "Dragon King Expansion",
      "kind": "expansion",
      "gameplay": true,
      "price": 8000,
      "versions": [
        { "v": "Sim", "$": [700], "r": "2025-11-25" },
        { "v": "1.6", "$": [6500, 8000], "r": "2021-11-26" }
      ],
      "url": "/products/dragon-king-expansion-1-6",
      "tags": ["expansion", "monster-dragon-king", "campaign", "node-4-quarry", "king"],
      "shopReachable": true
    },
    "expansion-lion-knight": {
      "name": "Lion Knight Expansion",
      "kind": "expansion",
      "gameplay": true,
      "price": 8000,
      "versions": [
        { "v": "Sim", "$": [700], "r": "2025-11-25" },
        { "v": "1.6", "$": [6500, 8000], "r": "2021-11-26" }
      ],
      "url": "/products/lion-knight-expansion-1-6",
      "tags": ["expansion", "monster-lion-knight", "knight", "nemesis", "showdown"],
      "shopReachable": true
    },
    "expansion-lion-god": {
      "name": "Lion God Expansion",
      "kind": "expansion",
      "gameplay": true,
      "price": 8000,
      "versions": [
        { "v": "Sim", "$": [700], "r": "2025-11-25" },
        { "v": "1.6", "$": [6500, 8000], "r": "2021-11-26" }
      ],
      "url": "/products/lion-god-expansion-1-6",
      "tags": ["expansion", "monster-lion-god", "nemesis", "scholar", "node-3-quarry"],
      "shopReachable": true
    },
    "expansion-manhunter": {
      "name": "Manhunter Expansion",
      "kind": "expansion",
      "gameplay": true,
      "price": 8000,
      "versions": [
        { "v": "Sim", "$": [700], "r": "2025-11-25" },
        { "v": "1.6", "$": [6500, 8000], "r": "2021-11-26" }
      ],
      "url": "/products/manhunter-expansion-1-6",
      "tags": ["expansion", "monster-manhunter", "nemesis", "gear", "survivor", "male"],
      "shopReachable": true
    },
    "expansion-slenderman": {
      "name": "Slenderman Expansion",
      "kind": "expansion",
      "gameplay": true,
      "price": 8000,
      "versions": [
        { "v": "Sim", "$": [700], "r": "2025-11-25" },
        { "v": "1.6", "$": [6500, 8000], "r": "2021-11-26" },
        { "v": "1.7", "$": [8000], "r": "Q4 2026" }
      ],
      "url": "/products/slenderman-expansion-1-6",
      "tags": ["expansion", "monster-slenderman", "nemesis", "dark"],
      "shopReachable": true
    },
    "expansion-lonely-tree": {
      "name": "Lonely Tree Expansion",
      "kind": "expansion",
      "gameplay": true,
      "price": 3500,
      "versions": [
        { "v": "Sim", "$": [700], "r": "2025-11-25" },
        { "v": "1.6", "$": [6500, 8000], "r": "2021-11-26" }
      ],
      "url": "/products/lonely-tree-expansion-1-6",
      "tags": ["expansion", "monster-lonely-tree", "special-showdown", "terrain"],
      "shopReachable": true
    },
    "expansion-green-knight-armor": {
      "name": "Green Knight Armor Expansion",
      "kind": "white-box",
      "gameplay": true,
      "price": 8000,
      "versions": [
        { "v": "Sim", "$": [700], "r": "2025-11-25" },
        { "v": "1.6", "$": [6500, 8000], "r": "2021-11-26" }
      ],
      "url": "/products/green-knight-armor-expansion-1-6",
      "requires": ["expansion-dung-beetle-knight", "expansion-gorm", "expansion-spidicules", "expansion-sunstalker"],
      "tags": ["expansion", "gear", "armor", "knight"],
      "shopReachable": false
    },
    "expansion-black-knight": {
      "name": "Black Knight Expansion",
      "kind": "expansion",
      "gameplay": true,
      "price": 8000,
      "versions": [
        { "v": "Sim", "$": [700], "r": "2025-11-25" },
        { "v": "1.6", "$": [6500, 8000], "r": "2021-11-26" }
      ],
      "url": "/products/black-knight-expansion",
      "tags": ["expansion", "monster-black-knight", "nemesis", "knight", "gear"],
      "shopReachable": true
    },
    "pinups-of-death-series-1": {
      "name": "Pinups Of Death I",
      "kind": "set",
      "gameplay": true,
      "price": 6000,
      "url": "/products/pinups-of-death-1",
      "tags": ["pinup", "bundle", "survivor", "female"],
      "shopReachable": true
    },
    "pinups-of-death-series-2": {
      "name": "Pinups Of Death II",
      "kind": "set",
      "gameplay": true,
      "price": 6000,
      "url": "/products/pinups-of-death-series-2",
      "tags": ["pinup", "bundle", "survivor", "female"],
      "shopReachable": true
    },
    "pinups-of-death-series-3": {
      "name": "Pinups Of Death III",
      "kind": "set",
      "gameplay": false,
      "price": 6000,
      "url": "/products/pinups-of-death-series-3",
      "tags": ["pinup", "bundle", "survivor", "female"],
      "shopReachable": true
    },
    "pinups-of-death-series-4": {
      "name": "Pinups Of Death IV",
      "kind": "set",
      "gameplay": false,
      "price": 6000,
      "url": "/products/pinups-of-death-series-iv",
      "tags": ["pinup", "bundle", "survivor", "female"],
      "shopReachable": true
    },
    "pinups-of-death-series-5": {
      "name": "Pinups Of Death V",
      "kind": "set",
      "gameplay": false,
      "price": 6000,
      "url": "/products/pinups-of-death-series-v",
      "tags": ["pinup", "bundle", "survivor", "female"],
      "shopReachable": true
    },
    "pinup-twilight-knight-deserter": {
      "name": "Pinup Twilight Knight Deserter",
      "kind": "model",
      "gameplay": false,
      "price": 3000,
      "url": "/products/pinup-twilight-knight-deserter-1",
      "tags": ["pinup", "twilight-knight", "survivor", "female"],
      "shopReachable": true
    },